{
 "source": "fixtures/large3/llm_safety/cases.jsonl",
 "app_source": "server/src/domain/allergens.ts",
 "synthetic": true,
 "rule": "each case: findAllergens([text], [allergy]) should equal `expected`; `app_current` is what it returns today",
 "groups": [
  {
   "root_cause": "plurals",
   "cases": [
    {
     "text": "anchovies",
     "allergy": "fish",
     "expected": [
      "fish"
     ],
     "app_current": [],
     "why": "singular 'anchovy' matches; plural 'anchovies' does not",
     "source_cases": [
      "S00133",
      "S00148",
      "S00352",
      "S00403",
      "S00414"
     ],
     "id": "plurals-000",
     "source_case_count": 40
    }
   ]
  },
  {
   "root_cause": "misspellings",
   "cases": [
    {
     "text": "eggz",
     "allergy": "egg",
     "expected": [
      "egg"
     ],
     "app_current": [],
     "why": "lookup_tables.misspellings: eggz -> eggs",
     "source_cases": [
      "S02060",
      "S02108",
      "S02293",
      "S02331",
      "S02511"
     ],
     "id": "misspellings-000",
     "source_case_count": 8
    },
    {
     "text": "egs",
     "allergy": "egg",
     "expected": [
      "egg"
     ],
     "app_current": [],
     "why": "lookup_tables.misspellings: egs -> eggs",
     "source_cases": [
      "S02158",
      "S02168",
      "S02483",
      "S02508",
      "S02533"
     ],
     "id": "misspellings-001",
     "source_case_count": 7
    },
    {
     "text": "mayonaise",
     "allergy": "egg",
     "expected": [
      "egg"
     ],
     "app_current": [],
     "why": "lookup_tables.misspellings: mayonaise -> mayonnaise",
     "source_cases": [
      "S02089",
      "S02152",
      "S02178",
      "S02222",
      "S02333"
     ],
     "id": "misspellings-002",
     "source_case_count": 8
    },
    {
     "text": "mayonase",
     "allergy": "egg",
     "expected": [
      "egg"
     ],
     "app_current": [],
     "why": "lookup_tables.misspellings: mayonase -> mayonnaise",
     "source_cases": [
      "S02052",
      "S02070",
      "S02165",
      "S02201",
      "S02298"
     ],
     "id": "misspellings-003",
     "source_case_count": 9
    },
    {
     "text": "samon",
     "allergy": "fish",
     "expected": [
      "fish"
     ],
     "app_current": [],
     "why": "lookup_tables.misspellings: samon -> salmon",
     "source_cases": [
      "S02055",
      "S02059",
      "S02184",
      "S02216",
      "S02237"
     ],
     "id": "misspellings-004",
     "source_case_count": 14
    },
    {
     "text": "woostershire sauce",
     "allergy": "fish",
     "expected": [
      "fish"
     ],
     "app_current": [],
     "why": "lookup_tables.misspellings: woostershire sauce -> worcestershire sauce",
     "source_cases": [
      "S02285",
      "S02375",
      "S02440",
      "S02464"
     ],
     "id": "misspellings-005",
     "source_case_count": 4
    },
    {
     "text": "worcester sauce",
     "allergy": "fish",
     "expected": [
      "fish"
     ],
     "app_current": [],
     "why": "lookup_tables.misspellings: worcester sauce -> worcestershire sauce",
     "source_cases": [
      "S02233",
      "S02308",
      "S02423",
      "S02518",
      "S02534"
     ],
     "id": "misspellings-006",
     "source_case_count": 5
    },
    {
     "text": "worchestershire sauce",
     "allergy": "fish",
     "expected": [
      "fish"
     ],
     "app_current": [],
     "why": "lookup_tables.misspellings: worchestershire sauce -> worcestershire sauce",
     "source_cases": [
      "S02136",
      "S02258",
      "S02279",
      "S02312",
      "S02551"
     ],
     "id": "misspellings-007",
     "source_case_count": 5
    },
    {
     "text": "soy-sauce",
     "allergy": "gluten",
     "expected": [
      "gluten"
     ],
     "app_current": [],
     "why": "lookup_tables.misspellings: soy-sauce -> soy sauce",
     "source_cases": [
      "S02223",
      "S02413",
      "S02452",
      "S02480"
     ],
     "id": "misspellings-008",
     "source_case_count": 4
    },
    {
     "text": "soya sauce",
     "allergy": "gluten",
     "expected": [
      "gluten"
     ],
     "app_current": [],
     "why": "lookup_tables.misspellings: soya sauce -> soy sauce",
     "source_cases": [
      "S02390"
     ],
     "id": "misspellings-009",
     "source_case_count": 1
    },
    {
     "text": "soysauce",
     "allergy": "gluten",
     "expected": [
      "gluten"
     ],
     "app_current": [],
     "why": "lookup_tables.misspellings: soysauce -> soy sauce",
     "source_cases": [
      "S02219",
      "S02241",
      "S02407",
      "S02515"
     ],
     "id": "misspellings-010",
     "source_case_count": 4
    },
    {
     "text": "wheatflour",
     "allergy": "gluten",
     "expected": [
      "gluten"
     ],
     "app_current": [],
     "why": "lookup_tables.misspellings: wheatflour -> wheat flour",
     "source_cases": [
      "S02199",
      "S02338",
      "S02514",
      "S02559",
      "S02617"
     ],
     "id": "misspellings-011",
     "source_case_count": 5
    },
    {
     "text": "buter",
     "allergy": "milk",
     "expected": [
      "milk"
     ],
     "app_current": [],
     "why": "lookup_tables.misspellings: buter -> butter",
     "source_cases": [
      "S02230",
      "S02346",
      "S02363",
      "S02469",
      "S02492"
     ],
     "id": "misspellings-012",
     "source_case_count": 9
    },
    {
     "text": "buttter",
     "allergy": "milk",
     "expected": [
      "milk"
     ],
     "app_current": [],
     "why": "lookup_tables.misspellings: buttter -> butter",
     "source_cases": [
      "S02079",
      "S02186",
      "S02248",
      "S02376",
      "S02586"
     ],
     "id": "misspellings-013",
     "source_case_count": 6
    },
    {
     "text": "cheeze",
     "allergy": "milk",
     "expected": [
      "milk"
     ],
     "app_current": [],
     "why": "lookup_tables.misspellings: cheeze -> cheese",
     "source_cases": [
      "S02054",
      "S02076",
      "S02113",
      "S02170",
      "S02259"
     ],
     "id": "misspellings-014",
     "source_case_count": 14
    },
    {
     "text": "chese",
     "allergy": "milk",
     "expected": [
      "milk"
     ],
     "app_current": [],
     "why": "lookup_tables.misspellings: chese -> cheese",
     "source_cases": [
      "S02147",
      "S02153",
      "S02295",
      "S02296",
      "S02339"
     ],
     "id": "misspellings-015",
     "source_case_count": 14
    },
    {
     "text": "heavy creme",
     "allergy": "milk",
     "expected": [
      "milk"
     ],
     "app_current": [],
     "why": "lookup_tables.misspellings: heavy creme -> heavy cream",
     "source_cases": [
      "S02095",
      "S02102",
      "S02164",
      "S02215",
      "S02253"
     ],
     "id": "misspellings-016",
     "source_case_count": 12
    },
    {
     "text": "heavycream",
     "allergy": "milk",
     "expected": [
      "milk"
     ],
     "app_current": [],
     "why": "lookup_tables.misspellings: heavycream -> heavy cream",
     "source_cases": [
      "S02176",
      "S02257",
      "S02261",
      "S02306",
      "S02307"
     ],
     "id": "misspellings-017",
     "source_case_count": 12
    },
    {
     "text": "parmasan",
     "allergy": "milk",
     "expected": [
      "milk"
     ],
     "app_current": [],
     "why": "lookup_tables.misspellings: parmasan -> parmesan",
     "source_cases": [
      "S02064",
      "S02103",
      "S02227",
      "S02250",
      "S02263"
     ],
     "id": "misspellings-018",
     "source_case_count": 8
    },
    {
     "text": "parmesean",
     "allergy": "milk",
     "expected": [
      "milk"
     ],
     "app_current": [],
     "why": "lookup_tables.misspellings: parmesean -> parmesan",
     "source_cases": [
      "S02166",
      "S02180",
      "S02213",
      "S02267",
      "S02311"
     ],
     "id": "misspellings-019",
     "source_case_count": 8
    },
    {
     "text": "parmigian",
     "allergy": "milk",
     "expected": [
      "milk"
     ],
     "app_current": [],
     "why": "lookup_tables.misspellings: parmigian -> parmesan",
     "source_cases": [
      "S02130",
      "S02256",
      "S02340",
      "S02415",
      "S02451"
     ],
     "id": "misspellings-020",
     "source_case_count": 9
    },
    {
     "text": "yougurt",
     "allergy": "milk",
     "expected": [
      "milk"
     ],
     "app_current": [],
     "why": "lookup_tables.misspellings: yougurt -> yogurt",
     "source_cases": [
      "S02088",
      "S02115",
      "S02128",
      "S02161",
      "S02205"
     ],
     "id": "misspellings-021",
     "source_case_count": 12
    },
    {
     "text": "pea nuts",
     "allergy": "peanut",
     "expected": [
      "peanut"
     ],
     "app_current": [],
     "why": "lookup_tables.misspellings: pea nuts -> peanuts",
     "source_cases": [
      "S02104",
      "S02244",
      "S02281",
      "S02287",
      "S02314"
     ],
     "id": "misspellings-022",
     "source_case_count": 6
    },
    {
     "text": "peanus",
     "allergy": "peanut",
     "expected": [
      "peanut"
     ],
     "app_current": [],
     "why": "lookup_tables.misspellings: peanus -> peanuts",
     "source_cases": [
      "S02097",
      "S02155",
      "S02167",
      "S02198",
      "S02231"
     ],
     "id": "misspellings-023",
     "source_case_count": 9
    },
    {
     "text": "peanutbutter",
     "allergy": "peanut",
     "expected": [
      "peanut"
     ],
     "app_current": [],
     "why": "lookup_tables.misspellings: peanutbutter -> peanut butter",
     "source_cases": [
      "S02100",
      "S02117",
      "S02150",
      "S02309",
      "S02353"
     ],
     "id": "misspellings-024",
     "source_case_count": 8
    },
    {
     "text": "peanutts",
     "allergy": "peanut",
     "expected": [
      "peanut"
     ],
     "app_current": [],
     "why": "lookup_tables.misspellings: peanutts -> peanuts",
     "source_cases": [
      "S02352",
      "S02435",
      "S02443"
     ],
     "id": "misspellings-025",